{"contract_version":"postgres-migration-manifest.v1","engine":"goose.v3","entries":[{"next_minimum_runtime_generation":1,"owner":"platform_migrator","phase":"foundation","scope":"platform","target_database_generation":1,"transaction_mode":"transactional","variants":{"fresh":{"path":"core/internal/platform/migrator/migrations/fresh/20260713010000_create_reject_mutation_routine.fresh.sql","sha256":"f878b3d9669c66d143cc6dc79b867b3c5b01acb6eb12f42022907756f5fa0910"},"v1_adopted":{"path":"core/internal/platform/migrator/migrations/v1_adopted/20260713010000_create_reject_mutation_routine.v1_adopted.sql","sha256":"f878b3d9669c66d143cc6dc79b867b3c5b01acb6eb12f42022907756f5fa0910"}},"version":20260713010000},{"next_minimum_runtime_generation":1,"owner":"platform_migrator","phase":"foundation","scope":"platform","target_database_generation":1,"transaction_mode":"transactional","variants":{"fresh":{"path":"core/internal/platform/migrator/migrations/fresh/20260713010100_create_environment_identity.fresh.sql","sha256":"da26b1f820b8b3c2fde2d4b80928527fdba28ffe951f8a3f5f1486d0f125b908"},"v1_adopted":{"path":"core/internal/platform/migrator/migrations/v1_adopted/20260713010100_create_environment_identity.v1_adopted.sql","sha256":"da26b1f820b8b3c2fde2d4b80928527fdba28ffe951f8a3f5f1486d0f125b908"}},"version":20260713010100},{"next_minimum_runtime_generation":1,"owner":"platform_migrator","phase":"foundation","scope":"platform","target_database_generation":1,"transaction_mode":"transactional","variants":{"fresh":{"path":"core/internal/platform/migrator/migrations/fresh/20260713010200_guard_environment_identity.fresh.sql","sha256":"999e81bb1ffd1c16312f7c02966fa9d799154e818f9331456c6b5b2cc92f882d"},"v1_adopted":{"path":"core/internal/platform/migrator/migrations/v1_adopted/20260713010200_guard_environment_identity.v1_adopted.sql","sha256":"999e81bb1ffd1c16312f7c02966fa9d799154e818f9331456c6b5b2cc92f882d"}},"version":20260713010200},{"next_minimum_runtime_generation":1,"owner":"platform_migrator","phase":"foundation","scope":"platform","target_database_generation":1,"transaction_mode":"transactional","variants":{"fresh":{"path":"core/internal/platform/migrator/migrations/fresh/20260713011000_create_bootstrap_receipts.fresh.sql","sha256":"bed7a370328e04c1673ce6794f1618dd0668769343e2857c9f6c42b29cb39cb6"},"v1_adopted":{"path":"core/internal/platform/migrator/migrations/v1_adopted/20260713011000_create_bootstrap_receipts.v1_adopted.sql","sha256":"bed7a370328e04c1673ce6794f1618dd0668769343e2857c9f6c42b29cb39cb6"}},"version":20260713011000},{"next_minimum_runtime_generation":1,"owner":"platform_migrator","phase":"foundation","scope":"platform","target_database_generation":1,"transaction_mode":"transactional","variants":{"fresh":{"path":"core/internal/platform/migrator/migrations/fresh/20260713011100_guard_bootstrap_receipts.fresh.sql","sha256":"149e878c35ae24932e066a58e5cbe357eec11446e63c25927a3b7712e4bb9c02"},"v1_adopted":{"path":"core/internal/platform/migrator/migrations/v1_adopted/20260713011100_guard_bootstrap_receipts.v1_adopted.sql","sha256":"149e878c35ae24932e066a58e5cbe357eec11446e63c25927a3b7712e4bb9c02"}},"version":20260713011100},{"next_minimum_runtime_generation":1,"owner":"platform_migrator","phase":"foundation","scope":"platform","target_database_generation":1,"transaction_mode":"transactional","variants":{"fresh":{"path":"core/internal/platform/migrator/migrations/fresh/20260713012000_create_extension_registry.fresh.sql","sha256":"02fdaa0197208027c7e0d31253d483eec2ebbb78bad678b60a45dc97efdcebec"},"v1_adopted":{"path":"core/internal/platform/migrator/migrations/v1_adopted/20260713012000_create_extension_registry.v1_adopted.sql","sha256":"02fdaa0197208027c7e0d31253d483eec2ebbb78bad678b60a45dc97efdcebec"}},"version":20260713012000},{"next_minimum_runtime_generation":1,"owner":"platform_migrator","phase":"foundation","scope":"platform","target_database_generation":1,"transaction_mode":"transactional","variants":{"fresh":{"path":"core/internal/platform/migrator/migrations/fresh/20260713012100_guard_extension_registry.fresh.sql","sha256":"dab4018541ee7898b41baa037b7234faf76a09c626361f041f553ca549843b60"},"v1_adopted":{"path":"core/internal/platform/migrator/migrations/v1_adopted/20260713012100_guard_extension_registry.v1_adopted.sql","sha256":"dab4018541ee7898b41baa037b7234faf76a09c626361f041f553ca549843b60"}},"version":20260713012100},{"next_minimum_runtime_generation":1,"owner":"platform_migrator","phase":"foundation","scope":"platform","target_database_generation":1,"transaction_mode":"transactional","variants":{"fresh":{"path":"core/internal/platform/migrator/migrations/fresh/20260713013000_create_migration_runs.fresh.sql","sha256":"ef850ab56e513417dfb00b1251bcf4edd359bf1a35b2976e8a3cb2d085e00b13"},"v1_adopted":{"path":"core/internal/platform/migrator/migrations/v1_adopted/20260713013000_create_migration_runs.v1_adopted.sql","sha256":"ef850ab56e513417dfb00b1251bcf4edd359bf1a35b2976e8a3cb2d085e00b13"}},"version":20260713013000},{"next_minimum_runtime_generation":1,"owner":"platform_migrator","phase":"foundation","scope":"platform","target_database_generation":1,"transaction_mode":"transactional","variants":{"fresh":{"path":"core/internal/platform/migrator/migrations/fresh/20260713013100_create_run_transition_routine.fresh.sql","sha256":"6f25ef85a8b1546c94be448250f3986cf0add8ef9569ff87d9039957360ac7e4"},"v1_adopted":{"path":"core/internal/platform/migrator/migrations/v1_adopted/20260713013100_create_run_transition_routine.v1_adopted.sql","sha256":"6f25ef85a8b1546c94be448250f3986cf0add8ef9569ff87d9039957360ac7e4"}},"version":20260713013100},{"next_minimum_runtime_generation":1,"owner":"platform_migrator","phase":"foundation","scope":"platform","target_database_generation":1,"transaction_mode":"transactional","variants":{"fresh":{"path":"core/internal/platform/migrator/migrations/fresh/20260713013200_guard_migration_run_transitions.fresh.sql","sha256":"cde95b0c7768842cab70829101dbc6387f1f1071639ae51e46d83bfecc5d07dc"},"v1_adopted":{"path":"core/internal/platform/migrator/migrations/v1_adopted/20260713013200_guard_migration_run_transitions.v1_adopted.sql","sha256":"cde95b0c7768842cab70829101dbc6387f1f1071639ae51e46d83bfecc5d07dc"}},"version":20260713013200},{"next_minimum_runtime_generation":1,"owner":"platform_migrator","phase":"foundation","scope":"platform","target_database_generation":1,"transaction_mode":"transactional","variants":{"fresh":{"path":"core/internal/platform/migrator/migrations/fresh/20260713014000_create_tenant_migration_checkpoints.fresh.sql","sha256":"1560369e1a0057e3ee5651c278183413912b95e875d9fa7847a460b16e7024f6"},"v1_adopted":{"path":"core/internal/platform/migrator/migrations/v1_adopted/20260713014000_create_tenant_migration_checkpoints.v1_adopted.sql","sha256":"1560369e1a0057e3ee5651c278183413912b95e875d9fa7847a460b16e7024f6"}},"version":20260713014000},{"next_minimum_runtime_generation":1,"owner":"platform_migrator","phase":"foundation","scope":"platform","target_database_generation":1,"transaction_mode":"transactional","variants":{"fresh":{"path":"core/internal/platform/migrator/migrations/fresh/20260713014100_create_checkpoint_transition_routine.fresh.sql","sha256":"370c70f7ff74e3086be74091813fc9050f287826189e133225c8c67a6587cd89"},"v1_adopted":{"path":"core/internal/platform/migrator/migrations/v1_adopted/20260713014100_create_checkpoint_transition_routine.v1_adopted.sql","sha256":"370c70f7ff74e3086be74091813fc9050f287826189e133225c8c67a6587cd89"}},"version":20260713014100},{"next_minimum_runtime_generation":1,"owner":"platform_migrator","phase":"foundation","scope":"platform","target_database_generation":1,"transaction_mode":"transactional","variants":{"fresh":{"path":"core/internal/platform/migrator/migrations/fresh/20260713014200_guard_checkpoint_transitions.fresh.sql","sha256":"b69831e3df41355136d55bf2dd35592660be2402b97235037dfc6a04c77ba8be"},"v1_adopted":{"path":"core/internal/platform/migrator/migrations/v1_adopted/20260713014200_guard_checkpoint_transitions.v1_adopted.sql","sha256":"b69831e3df41355136d55bf2dd35592660be2402b97235037dfc6a04c77ba8be"}},"version":20260713014200},{"next_minimum_runtime_generation":1,"owner":"platform_migrator","phase":"foundation","scope":"platform","target_database_generation":1,"transaction_mode":"transactional","variants":{"fresh":{"path":"core/internal/platform/migrator/migrations/fresh/20260713015000_create_schema_contracts.fresh.sql","sha256":"5bdb2cb92c8795e10a506c22f55f4d0026ec425c0d2fa4bb5b24aedcc9b2dfd2"},"v1_adopted":{"path":"core/internal/platform/migrator/migrations/v1_adopted/20260713015000_create_schema_contracts.v1_adopted.sql","sha256":"5bdb2cb92c8795e10a506c22f55f4d0026ec425c0d2fa4bb5b24aedcc9b2dfd2"}},"version":20260713015000},{"next_minimum_runtime_generation":1,"owner":"platform_migrator","phase":"foundation","scope":"platform","target_database_generation":1,"transaction_mode":"transactional","variants":{"fresh":{"path":"core/internal/platform/migrator/migrations/fresh/20260713015100_create_contract_transition_routine.fresh.sql","sha256":"fbe48479a1d3e3c7417d89c08e2ebc7871601b4384d7a9c6eb31b02f81801381"},"v1_adopted":{"path":"core/internal/platform/migrator/migrations/v1_adopted/20260713015100_create_contract_transition_routine.v1_adopted.sql","sha256":"fbe48479a1d3e3c7417d89c08e2ebc7871601b4384d7a9c6eb31b02f81801381"}},"version":20260713015100},{"next_minimum_runtime_generation":1,"owner":"platform_migrator","phase":"foundation","scope":"platform","target_database_generation":1,"transaction_mode":"transactional","variants":{"fresh":{"path":"core/internal/platform/migrator/migrations/fresh/20260713015200_guard_contract_transitions.fresh.sql","sha256":"2ce30fe7d53eb4d219967eac289fdfef98dc878ad3c1cd7025256475a6d8a212"},"v1_adopted":{"path":"core/internal/platform/migrator/migrations/v1_adopted/20260713015200_guard_contract_transitions.v1_adopted.sql","sha256":"2ce30fe7d53eb4d219967eac289fdfef98dc878ad3c1cd7025256475a6d8a212"}},"version":2026